{
  "schemaVersion": 1,
  "manifestKind": "windows-overlays",
  "predecessorCommit": "23d617bf19e1eab98070c3477fd787a69bb157ae",
  "sourceAuthority": "tests/visual/monochrome/route-manifest.ts",
  "sourceCommit": "7eb708e184ee4f054a49d3e70d73e80fd4eb97ae",
  "finalRouteIds": [
    "chat",
    "canvas",
    "workbench",
    "preview",
    "browser",
    "terminal",
    "kanban",
    "schedule",
    "agents",
    "agent-detail",
    "project-detail",
    "context",
    "skills",
    "benchmarks",
    "history",
    "tools",
    "files",
    "account"
  ],
  "settingsTabIds": [
    "account",
    "plans",
    "providers",
    "connections",
    "hive",
    "allaboutme",
    "plugins",
    "localmodels",
    "appearance",
    "voice",
    "composerstt",
    "phone",
    "ambient",
    "notifications",
    "accessibility",
    "hotkeys",
    "jarvisactions",
    "admin",
    "about"
  ],
  "entries": [
    {
      "id": "detached:dictation",
      "kind": "detached",
      "routeId": null,
      "auditStatus": "covered",
      "availability": "production",
      "owner": "SK9",
      "requirements": ["SAK-010", "SAK-030", "SAK-033", "SAK-040", "SAK-048", "SAK-036"],
      "sourcePaths": ["app/src/features/global-dictation/GlobalDictationOverlay.tsx"],
      "writerPaths": [],
      "testPaths": [
        "app/src/features/global-dictation/GlobalDictationOverlay.test.tsx",
        "tests/visual/monochrome/shell-overlay-manifest.test.ts"
      ],
      "behaviorCommands": [
        "npm --prefix app test -- src/features/global-dictation/GlobalDictationOverlay.test.tsx --maxWorkers=1 --minWorkers=1",
        "node --test tests/visual/monochrome/shell-overlay-manifest.test.ts"
      ],
      "viewports": ["1672x941", "1024x768", "narrow-desktop"],
      "zoom": ["50%", "80%", "100%", "125%", "200%"],
      "motion": ["no-preference", "reduce"],
      "baselineCaptureIds": ["default-chat", "jarvis-chat", "vibespace-chat", "origami-chat"],
      "logicalLock": "sakura:detached:dictation",
      "fileLockPaths": [],
      "sharedReadOnlyPaths": [
        "app/src/features/global-dictation/GlobalDictationOverlay.tsx",
        "tests/visual/monochrome/shell-overlay-manifest.test.ts"
      ],
      "exclusions": [
        "business behavior",
        "user or remote content",
        "non-Sakura themes",
        "backend, schema, auth, and billing changes"
      ],
      "unavailableReason": null
    },
    {
      "id": "detached:pet-mini-panel",
      "kind": "detached",
      "routeId": null,
      "auditStatus": "covered",
      "availability": "production",
      "owner": "SK9",
      "requirements": ["SAK-010", "SAK-030", "SAK-033", "SAK-040", "SAK-048", "SAK-036"],
      "sourcePaths": ["app/src/features/pets/PetMiniPanelWindow.tsx"],
      "writerPaths": [],
      "testPaths": ["tests/visual/monochrome/shell-overlay-manifest.test.ts"],
      "behaviorCommands": [
        "npm --prefix app test -- --maxWorkers=1 --minWorkers=1",
        "node --test tests/visual/monochrome/shell-overlay-manifest.test.ts"
      ],
      "viewports": ["1672x941", "1024x768", "narrow-desktop"],
      "zoom": ["50%", "80%", "100%", "125%", "200%"],
      "motion": ["no-preference", "reduce"],
      "baselineCaptureIds": ["default-chat", "jarvis-chat", "vibespace-chat", "origami-chat"],
      "logicalLock": "sakura:detached:pet-mini-panel",
      "fileLockPaths": [],
      "sharedReadOnlyPaths": [
        "app/src/features/pets/PetMiniPanelWindow.tsx",
        "tests/visual/monochrome/shell-overlay-manifest.test.ts"
      ],
      "exclusions": [
        "business behavior",
        "user or remote content",
        "non-Sakura themes",
        "backend, schema, auth, and billing changes"
      ],
      "unavailableReason": null
    },
    {
      "id": "detached:pet-overlay",
      "kind": "detached",
      "routeId": null,
      "auditStatus": "covered",
      "availability": "production",
      "owner": "SK9",
      "requirements": ["SAK-010", "SAK-030", "SAK-033", "SAK-040", "SAK-048", "SAK-036"],
      "sourcePaths": ["app/src/features/pets/PetOverlayWindow.tsx"],
      "writerPaths": [],
      "testPaths": [
        "app/src/features/pets/PetOverlayWindow.test.tsx",
        "tests/visual/monochrome/shell-overlay-manifest.test.ts"
      ],
      "behaviorCommands": [
        "npm --prefix app test -- src/features/pets/PetOverlayWindow.test.tsx --maxWorkers=1 --minWorkers=1",
        "node --test tests/visual/monochrome/shell-overlay-manifest.test.ts"
      ],
      "viewports": ["1672x941", "1024x768", "narrow-desktop"],
      "zoom": ["50%", "80%", "100%", "125%", "200%"],
      "motion": ["no-preference", "reduce"],
      "baselineCaptureIds": ["default-chat", "jarvis-chat", "vibespace-chat", "origami-chat"],
      "logicalLock": "sakura:detached:pet-overlay",
      "fileLockPaths": [],
      "sharedReadOnlyPaths": [
        "app/src/features/pets/PetOverlayWindow.tsx",
        "tests/visual/monochrome/shell-overlay-manifest.test.ts"
      ],
      "exclusions": [
        "business behavior",
        "user or remote content",
        "non-Sakura themes",
        "backend, schema, auth, and billing changes"
      ],
      "unavailableReason": null
    },
    {
      "id": "detached:workbench-main",
      "kind": "detached",
      "routeId": null,
      "auditStatus": "covered",
      "availability": "production",
      "owner": "SK9",
      "requirements": ["SAK-010", "SAK-030", "SAK-033", "SAK-040", "SAK-048", "SAK-036"],
      "sourcePaths": ["app/src/features/workbench/window.ts"],
      "writerPaths": [],
      "testPaths": [
        "app/src/features/workbench/window.test.ts",
        "tests/visual/monochrome/shell-overlay-manifest.test.ts"
      ],
      "behaviorCommands": [
        "npm --prefix app test -- src/features/workbench/window.test.ts --maxWorkers=1 --minWorkers=1",
        "node --test tests/visual/monochrome/shell-overlay-manifest.test.ts"
      ],
      "viewports": ["1672x941", "1024x768", "narrow-desktop"],
      "zoom": ["50%", "80%", "100%", "125%", "200%"],
      "motion": ["no-preference", "reduce"],
      "baselineCaptureIds": ["default-terminal", "jarvis-terminal", "vibespace-terminal"],
      "logicalLock": "sakura:detached:workbench-main",
      "fileLockPaths": [],
      "sharedReadOnlyPaths": [
        "app/src/features/workbench/window.ts",
        "tests/visual/monochrome/shell-overlay-manifest.test.ts"
      ],
      "exclusions": [
        "business behavior",
        "user or remote content",
        "non-Sakura themes",
        "backend, schema, auth, and billing changes"
      ],
      "unavailableReason": null
    },
    {
      "id": "native:dictation",
      "kind": "native",
      "routeId": null,
      "auditStatus": "native-only",
      "availability": "native-only",
      "owner": "SK9",
      "requirements": ["SAK-010", "SAK-030", "SAK-033", "SAK-040", "SAK-048", "SAK-036"],
      "sourcePaths": ["app/src-tauri/tauri.conf.json"],
      "writerPaths": [],
      "testPaths": ["tests/visual/monochrome/native-window-manifest.test.ts"],
      "behaviorCommands": [
        "npm --prefix app test -- --maxWorkers=1 --minWorkers=1",
        "node --test tests/visual/monochrome/native-window-manifest.test.ts"
      ],
      "viewports": ["1672x941", "1024x768", "narrow-desktop"],
      "zoom": ["50%", "80%", "100%", "125%", "200%"],
      "motion": ["no-preference", "reduce"],
      "baselineCaptureIds": ["default-chat", "jarvis-chat", "vibespace-chat", "origami-chat"],
      "logicalLock": "sakura:native:dictation",
      "fileLockPaths": [],
      "sharedReadOnlyPaths": [
        "app/src-tauri/tauri.conf.json",
        "tests/visual/monochrome/native-window-manifest.test.ts"
      ],
      "exclusions": [
        "business behavior",
        "user or remote content",
        "non-Sakura themes",
        "backend, schema, auth, and billing changes"
      ],
      "unavailableReason": null
    },
    {
      "id": "native:main",
      "kind": "native",
      "routeId": null,
      "auditStatus": "native-only",
      "availability": "native-only",
      "owner": "SK9",
      "requirements": ["SAK-010", "SAK-030", "SAK-033", "SAK-040", "SAK-048", "SAK-036"],
      "sourcePaths": ["app/src-tauri/tauri.conf.json"],
      "writerPaths": [],
      "testPaths": ["tests/visual/monochrome/native-window-manifest.test.ts"],
      "behaviorCommands": [
        "npm --prefix app test -- --maxWorkers=1 --minWorkers=1",
        "node --test tests/visual/monochrome/native-window-manifest.test.ts"
      ],
      "viewports": ["1672x941", "1024x768", "narrow-desktop"],
      "zoom": ["50%", "80%", "100%", "125%", "200%"],
      "motion": ["no-preference", "reduce"],
      "baselineCaptureIds": ["default-chat", "jarvis-chat", "vibespace-chat", "origami-chat"],
      "logicalLock": "sakura:native:main",
      "fileLockPaths": [],
      "sharedReadOnlyPaths": [
        "app/src-tauri/tauri.conf.json",
        "tests/visual/monochrome/native-window-manifest.test.ts"
      ],
      "exclusions": [
        "business behavior",
        "user or remote content",
        "non-Sakura themes",
        "backend, schema, auth, and billing changes"
      ],
      "unavailableReason": null
    },
    {
      "id": "native:pet-mini-panel",
      "kind": "native",
      "routeId": null,
      "auditStatus": "native-only",
      "availability": "native-only",
      "owner": "SK9",
      "requirements": ["SAK-010", "SAK-030", "SAK-033", "SAK-040", "SAK-048", "SAK-036"],
      "sourcePaths": ["app/src-tauri/src/pets.rs"],
      "writerPaths": [],
      "testPaths": ["tests/visual/monochrome/native-window-manifest.test.ts"],
      "behaviorCommands": [
        "npm --prefix app test -- --maxWorkers=1 --minWorkers=1",
        "node --test tests/visual/monochrome/native-window-manifest.test.ts"
      ],
      "viewports": ["1672x941", "1024x768", "narrow-desktop"],
      "zoom": ["50%", "80%", "100%", "125%", "200%"],